[
  {
    "session_id": "sess_9f4a2c****",
    "created_at": "2026-09-07T10:00:00Z",
    "status": "COMPLETED",
    "final_decision": "STEP_UP",
    "latency_ms": 842,
    "attempt_count": 2,
    "step_up": true,
    "has_error": false,
    "failed_gate": "L3_ENSEMBLE_ADV_RISK",
    "policy_version": "policy-v2",
    "model_version": "ensemble-risk-v3",
    "artifact_version": "1.1"
  },
  {
    "session_id": "sess_a132bc****",
    "created_at": "2026-09-07T09:54:12Z",
    "status": "COMPLETED",
    "final_decision": "ACCEPT",
    "latency_ms": 604,
    "attempt_count": 1,
    "step_up": false,
    "has_error": false,
    "failed_gate": null,
    "policy_version": "policy-v2",
    "model_version": "facenet-prod-2026-08",
    "artifact_version": "2.0"
  },
  {
    "session_id": "sess_71fe30****",
    "created_at": "2026-09-07T09:46:40Z",
    "status": "COMPLETED",
    "final_decision": "REJECT",
    "latency_ms": 318,
    "attempt_count": 1,
    "step_up": false,
    "has_error": false,
    "failed_gate": "L0_CAPTURE_INTEGRITY",
    "policy_version": "policy-v2",
    "model_version": "camera-binding-v1",
    "artifact_version": "1.0"
  },
  {
    "session_id": "sess_c09d81****",
    "created_at": "2026-09-07T09:40:05Z",
    "status": "ERROR",
    "final_decision": "ERROR",
    "latency_ms": 1200,
    "attempt_count": 1,
    "step_up": false,
    "has_error": true,
    "failed_gate": "L1_ILLUMINATION",
    "policy_version": "policy-v2",
    "model_version": "liveness-v4",
    "artifact_version": "1.2"
  },
  {
    "session_id": "sess_d88ef1****",
    "created_at": "2026-09-07T09:31:20Z",
    "status": "EXPIRED",
    "final_decision": "REJECT",
    "latency_ms": 0,
    "attempt_count": 3,
    "step_up": true,
    "has_error": false,
    "failed_gate": "L4_QUERY_BUDGET",
    "policy_version": "policy-v2",
    "model_version": "policy-runtime",
    "artifact_version": "1.0"
  }
]
